{
  "rules_version": 1,
  "run_id": "2026-10-17-cursor-composer-2-5-unknown",
  "series_id": "local-2026-10-cursor",
  "prompt_id": "paris-3d-atlas",
  "prompt_sha256": "19387b5a175db8f74b22515f1fce112c653d2286a5ab47fb46c4763176e64c1d",
  "shot": "primary",
  "parent_run_id": null,
  "model": {
    "provider": "xai",
    "name": "composer-2-5",
    "reasoning": "unknown"
  },
  "harness": {
    "name": "cursor",
    "version": null,
    "detail": ""
  },
  "wall_clock": {
    "started_at": "2026-10-16T23:44:03Z",
    "ended_at": "2026-10-17T00:49:38Z"
  },
  "tokens": {
    "split_rule": "unavailable",
    "reasoning_tokens": null,
    "visible_tokens": null,
    "raw": {
      "usage_csv": {
        "events_in_file": 1,
        "events_selected": 1,
        "selection": "1 event. composer-2.5-fast matches run model composer-2-5. Inside the run window.",
        "files": [
          "team-usage-events-2026-10-16.csv"
        ],
        "models": {
          "composer-2.5-fast": 1
        },
        "kinds": {
          "Included": 1
        },
        "users": 1,
        "fields": {
          "cache_write_tokens": "Input (w/ Cache Write)",
          "uncached_input_tokens": "Input (w/o Cache Write)",
          "cache_read_tokens": "Cache Read",
          "output_tokens": "Output Tokens",
          "total_tokens": "Total Tokens"
        },
        "max_mode": {
          "No": 1
        },
        "first_event_at": "2026-10-16T23:45:18.896Z",
        "last_event_at": "2026-10-16T23:45:18.896Z",
        "cache_read_tokens": 1060332,
        "cache_write_tokens": 0,
        "uncached_input_tokens": 47083,
        "output_tokens": 25867,
        "total_tokens": 1133282,
        "total_tokens_checked": 1,
        "total_tokens_mismatches": 0,
        "total_tokens_check": "matches",
        "cost": "1.01"
      }
    }
  },
  "model_time": {
    "source": "harness_model_time",
    "generating_seconds": 278.0,
    "raw": {}
  },
  "tool_calls": {
    "shell": {
      "calls": 0,
      "failures": 0,
      "by_tool": {}
    },
    "files": {
      "calls": 0,
      "failures": 0,
      "by_tool": {}
    },
    "visual_checks": {
      "calls": 0,
      "failures": 0,
      "by_tool": {}
    },
    "web": {
      "calls": 0,
      "failures": 0,
      "by_tool": {}
    },
    "other": {
      "calls": 0,
      "failures": 0,
      "by_tool": {}
    }
  },
  "context_reread": {
    "source": "provider_cache_read",
    "cache_read_tokens": 1060332,
    "cache_write_tokens": 0,
    "uncached_input_tokens": 47083,
    "raw": {
      "selection": "1 event. composer-2.5-fast matches run model composer-2-5. Inside the run window.",
      "events_selected": 1,
      "fields": {
        "cache_write_tokens": "Input (w/ Cache Write)",
        "uncached_input_tokens": "Input (w/o Cache Write)",
        "cache_read_tokens": "Cache Read",
        "output_tokens": "Output Tokens",
        "total_tokens": "Total Tokens"
      },
      "cache_read_tokens": 1060332,
      "cache_write_tokens": 0,
      "uncached_input_tokens": 47083,
      "total_tokens_check": "matches"
    }
  },
  "outcome": {
    "model_stopped": false,
    "operator_saw_a_page": true,
    "summary": "Stuck on the initial loading page"
  },
  "observations": ""
}
