{
  "rules_version": 1,
  "run_id": "2026-10-17-cursor-gemini-3-1-pro-unknown",
  "series_id": "local-2026-10-cursor",
  "prompt_id": "paris-3d-atlas",
  "prompt_sha256": "19387b5a175db8f74b22515f1fce112c653d2286a5ab47fb46c4763176e64c1d",
  "shot": "primary",
  "parent_run_id": null,
  "model": {
    "provider": "google",
    "name": "Gemini 3.1 Pro",
    "context": null,
    "reasoning": "unknown"
  },
  "harness": {
    "name": "cursor",
    "version": "3.23.23",
    "detail": ""
  },
  "wall_clock": {
    "started_at": "2026-10-17T02:47:30Z",
    "ended_at": "2026-10-17T02:53:59Z"
  },
  "tokens": {
    "split_rule": "unavailable",
    "reasoning_tokens": null,
    "visible_tokens": null,
    "raw": {
      "usage_csv": {
        "events_in_file": 2,
        "events_selected": 1,
        "selection": "1 of 2 events. Exact model match for Gemini 3.1 Pro. Events from 2026-10-17T02:47:30+00:00 through 2026-10-17T02:53:59+00:00.",
        "files": [
          "team-usage-events-2026-10-17-bis.csv"
        ],
        "models": {
          "gemini-3.1-pro": 1
        },
        "kinds": {
          "Included": 1
        },
        "users": 1,
        "fields": {
          "cache_write_tokens": "Input (w/ Cache Write)",
          "uncached_input_tokens": "Input (w/o Cache Write)",
          "cache_read_tokens": "Cache Read",
          "output_tokens": "Output Tokens",
          "total_tokens": "Total Tokens"
        },
        "max_mode": {
          "No": 1
        },
        "first_event_at": "2026-10-17T02:47:31.079Z",
        "last_event_at": "2026-10-17T02:47:31.079Z",
        "cache_read_tokens": 1923820,
        "cache_write_tokens": 0,
        "uncached_input_tokens": 349822,
        "output_tokens": 22351,
        "total_tokens": 2295993,
        "total_tokens_checked": 1,
        "total_tokens_mismatches": 0,
        "total_tokens_check": "matches",
        "cost": "1.88"
      }
    }
  },
  "model_time": {
    "source": "harness_model_time",
    "generating_seconds": 389.0,
    "raw": {}
  },
  "tool_calls": {
    "shell": {
      "calls": 39,
      "failures": 6,
      "by_tool": {
        "Shell": {
          "calls": 39,
          "failures": 6
        }
      }
    },
    "files": {
      "calls": 17,
      "failures": 7,
      "by_tool": {
        "Read": {
          "calls": 17,
          "failures": 7
        }
      }
    },
    "visual_checks": {
      "calls": 0,
      "failures": 0,
      "by_tool": {}
    },
    "web": {
      "calls": 0,
      "failures": 0,
      "by_tool": {}
    },
    "other": {
      "calls": 0,
      "failures": 0,
      "by_tool": {}
    }
  },
  "context_reread": {
    "source": "provider_cache_read",
    "cache_read_tokens": 1923820,
    "cache_write_tokens": 0,
    "uncached_input_tokens": 349822,
    "raw": {
      "selection": "1 of 2 events. Exact model match for Gemini 3.1 Pro. Events from 2026-10-17T02:47:30+00:00 through 2026-10-17T02:53:59+00:00.",
      "events_selected": 1,
      "fields": {
        "cache_write_tokens": "Input (w/ Cache Write)",
        "uncached_input_tokens": "Input (w/o Cache Write)",
        "cache_read_tokens": "Cache Read",
        "output_tokens": "Output Tokens",
        "total_tokens": "Total Tokens"
      },
      "cache_read_tokens": 1923820,
      "cache_write_tokens": 0,
      "uncached_input_tokens": 349822,
      "total_tokens_check": "matches"
    }
  },
  "outcome": {
    "model_stopped": true,
    "operator_saw_a_page": true,
    "summary": "Working one-page visualization"
  },
  "observations": "Tool counts use the first prompt and the first stop."
}
